{"experiment_id": 1, "branch": "main", "worker": 1, "status": "keep", "hypothesis": "Adding instructions to read code before changing it, prioritize algorithmic changes early, and learn from log patterns will reduce wasted experiments and improve convergence speed.", "diff": "--- experiment.md (before)\n+++ experiment.md (after)\n@@ Step 3: Formulate hypothesis @@\n\nOld step 3 directly formulated hypothesis.\n\nNew version adds:\n- Step 3: Read the code being optimized (NEW)\n  - Understand current algorithm and bottlenecks\n  - Check data structures\n  - Look for algorithmic improvement opportunities\n- Step 4: Formulate hypothesis (renumbered from 3)\n  - Added strategy guidance:\n    * Early experiments: prioritize algorithmic changes over micro-opts\n    * Consider numpy/native extensions early (target ~60M items/sec)\n    * Learn from log patterns to avoid repeating failed approaches\n- Steps 5-8: Renumbered (previously 4-7)\n- Updated skip reference in thought experiment section (7 \u2192 8)", "score": 28436703.59, "best_score_at_time": 12454075.6, "improved": true, "timestamp": "2026-04-11T16:30:10.027381Z"}
{"experiment_id": 2, "branch": "main", "worker": 2, "status": "keep", "hypothesis": "Adding explicit instructions for agents to check recent log entries for patterns and coordinate to avoid duplicate exploration will reduce wasted experiments and improve convergence speed.", "diff": "--- experiment.md (before)\n+++ experiment.md (after)\n@@ section 3: Formulate hypothesis @@\n Write a specific, testable hypothesis as a single sentence. Consider:\n - What hasn't been tried yet (check the log)\n - Results from all branches (check the branch registry)\n - If there's a guardrail warning, explain why your approach differs from recent failures\n+- **Learn from patterns**: Look for what types of changes worked vs failed in recent experiments\n+- **Avoid duplication**: If multiple experiments just ran, assume parallel workers tried the obvious approaches \u2014 differentiate your hypothesis\n+- **Prioritize impact**: In early experiments, prefer algorithmic improvements over micro-optimizations\n\n Write the hypothesis to `latest_hypothesis.txt` in your worker directory.", "score": 22090503.91, "best_score_at_time": 12454075.6, "improved": true, "timestamp": "2026-04-11T16:30:10.028896Z"}
{"experiment_id": 3, "branch": "main", "worker": 3, "status": "keep", "hypothesis": "Adding worker-specific differentiation instructions (conservative for worker-1, moderate for worker-2, aggressive for worker-3) will reduce redundant experiments and improve parallel exploration efficiency.", "diff": "--- experiment.md (before)\n+++ experiment.md (after)\n@@ -12,6 +12,14 @@\n - Current best score\n - Optional guardrail warning (if discard streak is high)\n\n+## Worker Differentiation Strategy\n+\n+Your worker ID is embedded in your worker directory path. Check which worker you are and follow the appropriate strategy to maximize parallel exploration:\n+\n+- **worker-1**: Conservative approach. Make small, safe, well-tested changes. Focus on code quality improvements, minor optimizations, and proven patterns.\n+- **worker-2**: Moderate approach. Balance between safety and innovation. Try established algorithmic improvements and standard library optimizations.\n+- **worker-3**: Aggressive approach. Take risks. Try radical algorithmic changes, native extensions (numpy/C), and unconventional approaches even if they might fail.\n+\n ## Steps\n\n ### 1. Read context\n@@ -44,13 +52,18 @@\n - What hasn't been tried yet (check the log)\n - Results from all branches (check the branch registry)\n - If there's a guardrail warning, explain why your approach differs from recent failures\n+- Your worker differentiation strategy (conservative, moderate, or aggressive)\n+- In early rounds, prioritize algorithmic changes over micro-optimizations\n+- Consider numpy/native extensions for big performance gains\n\n Write the hypothesis to `latest_hypothesis.txt` in your worker directory.\n\n ### 4. Make the change\n\n-Edit files in your worker directory ONLY. Only modify files listed as editable in the research directions. Make a small, focused change that tests your hypothesis.\n+First, READ the current code carefully to understand how it works. Don't make blind guesses.\n\n+Then edit files in your worker directory ONLY. Only modify files listed as editable in the research directions. Make a small, focused change that tests your hypothesis.\n+\n Never edit:\n - eval.sh, lockfile.txt, program.md, best_score.txt, state.json\n - log.jsonl, branches.jsonl, findings.md", "score": 127442759.08, "best_score_at_time": 12454075.6, "improved": true, "timestamp": "2026-04-11T16:30:10.029860Z"}
{"experiment_id": 4, "branch": "main", "worker": 1, "status": "discard", "hypothesis": "Refining worker differentiation with specific technical focus areas (data structures, algorithms, native extensions) instead of abstract risk levels will improve parallel exploration efficiency and convergence speed.", "diff": "--- experiment.md (before)\n+++ experiment.md (after)\n@@ -12,6 +12,16 @@\n - Current best score\n - Optional guardrail warning (if discard streak is high)\n\n+## Worker Differentiation Strategy\n+\n+Maximize parallel exploration by giving each worker a distinct technical focus:\n+\n+- **worker-1**: Data structures & memory. Focus on choosing optimal data structures (lists vs arrays vs numpy), memory layout, avoiding copies, cache-friendly patterns.\n+- **worker-2**: Algorithms & logic. Focus on algorithmic improvements, choosing better algorithms, reducing complexity, smarter control flow.\n+- **worker-3**: Native extensions & radical changes. Focus on numpy vectorization, native C extensions, or complete algorithmic rewrites even if risky.\n+\n ## Steps\n\n ### 1. Read context\n@@ -41,13 +51,18 @@\n ### 3. Formulate hypothesis\n\n Write a specific, testable hypothesis as a single sentence. Consider:\n - What hasn't been tried yet (check the log)\n - Results from all branches (check the branch registry)\n - If there's a guardrail warning, explain why your approach differs from recent failures\n+- Your worker's technical focus area (data structures, algorithms, or native extensions)\n+- Prioritize algorithmic/structural changes over micro-optimizations in early rounds\n\n Write the hypothesis to `latest_hypothesis.txt` in your worker directory.\n\n ### 4. Make the change\n\n+First, READ the code being optimized to understand how it currently works. Don't make blind changes.\n+\n Edit files in your worker directory ONLY. Only modify files listed as editable in the research directions. Make a small, focused change that tests your hypothesis.\n\n Never edit:", "score": 59943054.1, "best_score_at_time": 127442759.08, "improved": false, "timestamp": "2026-04-11T16:35:16.365691Z"}
{"experiment_id": 5, "branch": "main", "worker": 2, "status": "discard", "hypothesis": "Adding instructions for agents to estimate the potential performance gain of their hypothesis before implementing will help prioritize high-impact changes and reduce wasted experiments on low-ceiling optimizations.", "diff": "--- experiment.md (before)\n+++ experiment.md (after)\n@@ Step 3: Formulate hypothesis @@\n\nOld formulate hypothesis section had:\n- What hasn't been tried yet (check the log)\n- Results from all branches (check the branch registry)\n- If there's a guardrail warning, explain why your approach differs from recent failures\n\nAdded two new bullet points:\n+- **Estimate potential gain**: Before committing to a hypothesis, estimate the performance ceiling of your approach. Check the current best score and consider if your change could realistically improve it. Small optimizations on already-fast code may not be worth testing.\n+- **Prioritize high-impact changes**: If multiple ideas come to mind, choose the one with the highest potential upside relative to the current best score.", "score": 12024650.53, "best_score_at_time": 127442759.08, "improved": false, "timestamp": "2026-04-11T16:35:16.367464Z"}
{"experiment_id": 6, "branch": "main", "worker": 3, "status": "discard", "hypothesis": "Combining worker differentiation with explicit code-reading requirements, tactical guidance for numpy-based optimization, and condensed instructions will improve experiment quality and convergence speed.", "diff": "--- experiment.md (before)\n+++ experiment.md (after)\n@@ Inputs section (after line 13) @@\n+ Added \"## Worker Differentiation Strategy\" section:\n+   - worker-1: Conservative (small, safe changes, minor optimizations)\n+   - worker-2: Moderate (balanced, standard algorithmic improvements)\n+   - worker-3: Aggressive (high-risk, radical changes, numpy/native extensions)\n+ This helps parallel workers avoid redundant exploration.\n\n@@ Step 1: Read context (line 25) @@\n- Understand what has been tried, what worked, what failed.\n+ Understand what has been tried, what worked, what failed. Look for patterns: what types of changes yielded improvements vs. failures?\n\n@@ Step 2: Thought experiment skip reference (line 39) @@\n- Skip to step 7\n+ Skip to step 8\n\n@@ Step 3: Formulate hypothesis @@\n- Renamed to \"### 3. Read the target code\" (NEW STEP)\n+ Before formulating hypothesis, READ the code being optimized:\n+   - Current algorithm and data structures\n+   - Performance bottlenecks\n+   - Opportunities for improvement (algorithmic vs micro-optimizations)\n\n@@ Step 4: Formulate hypothesis (renumbered from 3) @@\n+ Added strategic considerations:\n+   - What hasn't been tried yet (check the log for patterns)\n+   - Results from all branches\n+   - Your worker differentiation strategy\n+   - Avoid obvious approaches parallel workers likely tried\n+   - For sorting benchmarks: numpy-based approaches can reach ~60M items/sec\n+   - Early rounds: prioritize algorithmic improvements over micro-optimizations\n+   - If there's a guardrail warning, explain difference from recent failures\n\n@@ Step 5: Make the change (renumbered from 4, line 52) @@\n- Make a small, focused change that tests your hypothesis.\n+ Make a focused change that tests your hypothesis.\n  (Removed \"small\" to allow aggressive worker flexibility)\n\n@@ Steps 5-7 renumbered to 6-8 @@\n- Step 5: Record the diff \u2192 Step 6: Record the diff\n- Step 6: Run eval and record score \u2192 Step 7: Run eval and record score\n- Step 7: Write experiment ID confirmation \u2192 Step 8: Write experiment ID confirmation\n\n@@ Important section (line 82-88) @@\n- Try different things across experiments. Don't repeat what the log shows was already tried.\n- Keep changes small and atomic \u2014 one idea per experiment.\n+ Read the target code before making changes. Don't make blind guesses.\n+ Follow your worker differentiation strategy to maximize parallel exploration value.\n+ Don't repeat approaches already in the log. Look for patterns in what worked vs failed.\n+ Keep changes focused \u2014 one idea per experiment.\n  (Emphasized code reading, differentiation strategy, pattern learning; changed \"small and atomic\" to \"focused\" for flexibility)", "score": 43792423.91, "best_score_at_time": 127442759.08, "improved": false, "timestamp": "2026-04-11T16:35:16.368371Z"}
{"experiment_id": 7, "branch": "main", "worker": 1, "status": "keep", "hypothesis": "Condensing the experiment prompt to reduce verbosity while preserving core strategic elements (worker differentiation, code reading, pattern learning) will improve agent effectiveness by reducing cognitive load and token usage.", "diff": "--- experiment.md (before)\n+++ experiment.md (after)\n@@ header and inputs section @@\n- Verbose intro: \"You are the autoresearch experiment skill. You run headless (no human interaction). One invocation = one experiment. You work in an isolated worker directory.\"\n- Detailed inputs list with 7 bullet points\n+ Concise intro: \"You run headless. One invocation = one experiment in an isolated worker directory.\"\n+ Added \"## Worker Strategy\" section before steps (moved from being absent):\n  - worker-1: Conservative. Small, safe changes. Minor optimizations.\n  - worker-2: Moderate. Balanced algorithmic improvements.\n  - worker-3: Aggressive. Radical changes, numpy/native extensions, high risk/reward.\n\n@@ Step 1: Read context @@\n- Long list format with full descriptions\n- \"Understand what has been tried, what worked, what failed.\"\n+ Compact: \"From autoresearch directory, read: program.md, log.jsonl (last 10 lines), findings.md, branches.jsonl.\"\n+ \"Understand what worked, what failed, and patterns in the results.\"\n\n@@ Step 2: Thought experiment @@\n- Long bullet list of conditions\n- Verbose instructions\n+ Condensed to 2 lines: when to use, what to write\n\n@@ Step 3: NEW - Read target code @@\n+ Added new step: \"READ the code you'll optimize. Understand current algorithm, data structures, and bottlenecks before making blind changes.\"\n\n@@ Step 4: Formulate hypothesis (renumbered from 3) @@\n- Separate bullet for each consideration\n+ Condensed bullets, added strategic guidance:\n  - Patterns from log (what worked/failed)\n  - Worker strategy\n  - Early rounds: algorithmic > micro-optimizations\n  - For sorting: numpy can reach ~60M items/sec\n  - Avoid obvious moves parallel workers tried\n\n@@ Steps 5-8: Make change, Record diff, Run eval, Confirm (renumbered from 4-7) @@\n- Verbose explanations for each step\n- Long \"Never edit\" list\n+ Ultra-condensed:\n  - Step 5: 2 sentences + 1 line never-edit list\n  - Step 6: 4 lines (was 8)\n  - Step 7: 3 lines (was 5)\n  - Step 8: 1 line (was 2)\n\n@@ Important section @@\n- 6 verbose bullet points\n- \"The orchestrator handles the keep/discard decision. You just produce a hypothesis, change, and score.\"\n+ Renamed to \"## Notes\"\n+ 6 ultra-condensed bullets\n+ Removed redundant orchestrator explanation", "score": 130875662.89, "best_score_at_time": 127442759.08, "improved": true, "timestamp": "2026-04-11T16:40:04.212212Z"}
{"experiment_id": 8, "branch": "main", "worker": 2, "status": "keep", "hypothesis": "Adding simplified worker differentiation strategy and explicit code-reading step without over-engineering will improve experiment quality and convergence speed by leveraging exp 3's successful pattern while avoiding exp 4-6's complexity.", "diff": "--- experiment.md (before)\n+++ experiment.md (after)\n@@ After line 13 (Optional guardrail warning) @@\n\n+## Worker Differentiation\n+\n+Each worker should explore different risk levels to maximize parallel coverage:\n+- **worker-1**: Conservative - small, safe improvements\n+- **worker-2**: Moderate - balanced algorithmic improvements\n+- **worker-3**: Aggressive - radical changes, numpy/native extensions\n+\n\n@@ Step 2: thought experiment skip reference @@\n- Skip to step 7\n+ Skip to step 8\n\n@@ Step 3: Formulate hypothesis @@\n-### 3. Formulate hypothesis\n+### 3. Read the code\n+\n+Before formulating a hypothesis, read the code being optimized to understand the current implementation and identify opportunities.\n+\n+### 4. Formulate hypothesis\n\n@@ Step 4: hypothesis considerations @@\n - What hasn't been tried yet (check the log)\n - Results from all branches (check the branch registry)\n - If there's a guardrail warning, explain why your approach differs from recent failures\n+- Your worker's risk level (conservative, moderate, or aggressive)\n+- Early experiments: prioritize algorithmic changes over micro-optimizations\n\n@@ Renumbered steps 4-7 to 5-8 @@\n-### 4. Make the change\n+### 5. Make the change\n\n-### 5. Record the diff\n+### 6. Record the diff\n\n-### 6. Run eval and record score\n+### 7. Run eval and record score\n\n-### 7. Write experiment ID confirmation\n+### 8. Write experiment ID confirmation", "score": 130718954.25, "best_score_at_time": 127442759.08, "improved": true, "timestamp": "2026-04-11T16:40:04.213881Z"}
{"experiment_id": 9, "branch": "main", "worker": 3, "status": "discard", "hypothesis": "Adding explicit instructions to analyze the log for high-scoring vs low-scoring patterns and prioritize approaches similar to successful experiments will improve hypothesis quality and convergence speed.", "diff": "--- experiment.md (before)\n+++ experiment.md (after)\n@@ Step 1: Read context (after line 25) @@\n\n Understand what has been tried, what worked, what failed.\n+\n+**Analyze the log strategically:**\n+- Identify which experiments had high scores (improved=true) vs low scores (improved=false)\n+- Look for patterns in successful experiments: what types of changes worked? What common elements do they share?\n+- Look for patterns in failed experiments: what approaches consistently underperform?\n+- Prioritize hypotheses that resemble successful experiments and avoid patterns that failed", "score": 57375111.59, "best_score_at_time": 127442759.08, "improved": false, "timestamp": "2026-04-11T16:40:04.214645Z"}
